{
  "$schema": "https://json-schema.org/draft/2020-12/schema",
  "$id": "leia://generic-ai/agent-runner/tool-contract-agent-projection-v1",
  "title": "Generic Tool Contract To Agent Runner Projection",
  "type": "object",
  "required": [
    "schema_version",
    "fixture_key",
    "projection_kind",
    "provider_free",
    "live_network",
    "real_dependency_imports",
    "source_fixture_refs",
    "projected_agent_tools",
    "tool_history_mappings",
    "loop_trace_mappings",
    "replay_policy_mapping",
    "projection_assertions"
  ],
  "properties": {
    "schema_version": {
      "const": 1
    },
    "fixture_key": {
      "const": "generic:agent_runner:tool_contract_projection"
    },
    "projection_kind": {
      "const": "tool_contract_to_agent_runner_projection"
    },
    "provider_free": {
      "const": true
    },
    "live_network": {
      "const": false
    },
    "real_dependency_imports": {
      "const": false
    },
    "source_fixture_refs": {
      "type": "object"
    },
    "projected_agent_tools": {
      "type": "array",
      "minItems": 1
    },
    "tool_history_mappings": {
      "type": "array",
      "minItems": 1
    },
    "loop_trace_mappings": {
      "type": "array",
      "minItems": 1
    },
    "replay_policy_mapping": {
      "type": "object"
    },
    "projection_assertions": {
      "type": "object"
    }
  }
}
