{
  "schema_version": 1,
  "fixture_key": "generic:agent_runner:tool_contract_projection",
  "projection_kind": "tool_contract_to_agent_runner_projection",
  "provider_free": true,
  "live_network": false,
  "real_dependency_imports": false,
  "source_fixture_refs": {
    "tool_contract_projection": "../generic_tool_contracts/fixtures/registry_descriptor_to_tool_contract_projection_fixture.json",
    "agent_config": "fixtures/agent_config_fixture.json",
    "loop_trace": "fixtures/loop_trace_fixture.json",
    "structured_output": "fixtures/structured_output_fixture.json"
  },
  "projected_agent_tools": [
    {
      "source_tool_name": "summarize_rows",
      "agent_tool_name": "summarize_rows",
      "capability": "generic.ai.tool.contract",
      "approval_required": false,
      "provider_free": true,
      "replay_key": "generic_tool:invocation:trace:v1",
      "agent_config_action": "append_tool_config"
    },
    {
      "source_tool_name": "publish_artifact",
      "agent_tool_name": "publish_artifact",
      "capability": "generic.ai.tool.contract",
      "approval_required": true,
      "provider_free": true,
      "replay_key": "generic_tool:approval:denied:v1",
      "agent_config_action": "append_tool_config_as_denied_until_approved"
    }
  ],
  "tool_history_mappings": [
    {
      "seq": 1,
      "source_tool_name": "summarize_rows",
      "agent_tool_name": "summarize_rows",
      "source_result_ok": true,
      "agent_status": "ok",
      "result_ref": "generic_tool:invocation:trace:v1",
      "replay_ready": true,
      "provider_free": true
    },
    {
      "seq": 2,
      "source_tool_name": "publish_artifact",
      "agent_tool_name": "publish_artifact",
      "source_result_ok": false,
      "source_error_kind": "approval_denied",
      "agent_status": "denied",
      "result_ref": "generic_tool:approval:denied:v1",
      "replay_ready": true,
      "provider_free": true
    }
  ],
  "loop_trace_mappings": [
    {
      "source_tool_name": "summarize_rows",
      "source_replay_key": "generic_tool:invocation:trace:v1",
      "agent_event_type": "tool_result",
      "agent_correlation_policy": "new_tool_correlation_id_per_replay_key",
      "agent_status": "ok"
    },
    {
      "source_tool_name": "publish_artifact",
      "source_replay_key": "generic_tool:approval:denied:v1",
      "agent_event_type": "tool_result",
      "agent_correlation_policy": "new_tool_correlation_id_per_replay_key",
      "agent_status": "denied"
    }
  ],
  "replay_policy_mapping": {
    "source_replay_mode": "fixture_replay",
    "agent_replay_mode": "fixture_replay",
    "strict_ordered_match": true,
    "unconsumed_records": "fail_closed",
    "clean_skip_without_replay": true
  },
  "projection_assertions": {
    "tool_contract_names_project_to_agent_tools": true,
    "result_envelopes_project_to_tool_history": true,
    "approval_denied_projects_to_denied_history_not_live_execution": true,
    "replay_keys_are_preserved_as_result_refs": true,
    "agent_loop_trace_owns_correlation_ids": true,
    "trace_event_schema_is_not_redefined": true,
    "provider_free_boundary_preserved": true,
    "live_network_absent": true,
    "real_dependency_imports_absent": true
  }
}
